{
  "$schema": "../../schemas/v2/flow.schema.json",
  "schemaVersion": 2,
  "kind": "flow",
  "id": "FLOW-FIN-001",
  "title": "행사 구매 요청 제출",
  "revision": 2,
  "status": "approved",
  "supersedes": {
    "id": "FLOW-FIN-001",
    "revision": 1
  },
  "changeSummary": "R1의 브라우저 환경 기반 임시 저장을 같은 계정의 서버 개인 초안으로 확장하고, 저장 성공·실패 피드백을 명시합니다.",
  "approval": {
    "approvedBy": "제품 책임자",
    "approvedAt": "2026-08-03T16:38:57+09:00"
  },
  "sourceEvidence": [
    {
      "id": "SRC-001",
      "title": "현재 구매 요청 화면 구현",
      "kind": "repository_file",
      "authority": "current_wireframe_screen",
      "approvalState": "current",
      "conflictsWith": [
        "SRC-004",
        "SRC-005",
        "SRC-007",
        "SRC-008"
      ],
      "locator": {
        "kind": "repository_path",
        "value": "C:/Users/82108/Downloads/VADA-wireframe/src/app/App.tsx"
      },
      "observedAt": "2026-08-03T15:55:17+09:00",
      "sourceVersion": {
        "kind": "content_digest",
        "value": "sha256:7E541F87C7F4D92505A80AB3E43E534775CED204C1DB64E6DA44647E1EF7CE96"
      },
      "note": "FIN-REQ-01B의 입력·검증·임시 저장·제출, MY-REQ-01의 결과 목록과 FIN-REQ-02 진입을 대조했습니다."
    },
    {
      "id": "SRC-002",
      "title": "VADA 권한 매트릭스",
      "kind": "repository_file",
      "authority": "wireframe_internal_document",
      "approvalState": "current",
      "conflictsWith": [
        "SRC-005"
      ],
      "locator": {
        "kind": "repository_path",
        "value": "C:/Users/82108/Downloads/VADA-wireframe/docs/VADA_PERMISSION_MATRIX.md"
      },
      "observedAt": "2026-08-03T15:55:17+09:00",
      "sourceVersion": {
        "kind": "content_digest",
        "value": "sha256:866A7F453F19E84724D83D1B61366BF80A9BF0E4AB93A47D3D2EB4DC86D8A85C"
      },
      "note": "부서장과 재정부의 제출 권한을 확인합니다."
    },
    {
      "id": "SRC-003",
      "title": "VADA 재정 명세",
      "kind": "repository_file",
      "authority": "wireframe_internal_document",
      "approvalState": "current",
      "conflictsWith": [],
      "locator": {
        "kind": "repository_path",
        "value": "C:/Users/82108/Downloads/VADA-wireframe/docs/VADA_FINANCE_SPEC.md"
      },
      "observedAt": "2026-08-03T15:55:17+09:00",
      "sourceVersion": {
        "kind": "content_digest",
        "value": "sha256:4516F54738AAEF3096E01EAF64C665E2F4D4B864682F0DCBA90535A19139423A"
      },
      "note": "한 행사·다품목 요청과 예산 초과 제출 허용 규칙을 제공합니다. 화면과 다른 세부 필드명은 채택하지 않습니다."
    },
    {
      "id": "SRC-004",
      "title": "구매 요청 입력 기준 기획 작업",
      "kind": "notion_page",
      "authority": "notion_document",
      "approvalState": "pending",
      "conflictsWith": [
        "SRC-001"
      ],
      "locator": {
        "kind": "uri",
        "value": "https://app.notion.com/p/3ab68a85148e8185b22ef91af73e5d5b"
      },
      "observedAt": "2026-08-03T14:34:15+09:00",
      "sourceVersion": {
        "kind": "last_edited_at",
        "value": "2026-08-02T09:21:20.474Z"
      },
      "note": "본문 답변은 있으나 작업 상태가 진행 전이고 현재 화면과 필드·필수 조건이 달라 승인 규칙에 사용하지 않습니다."
    },
    {
      "id": "SRC-005",
      "title": "구매 요청 접근 권한 기획 작업",
      "kind": "notion_page",
      "authority": "notion_document",
      "approvalState": "historical",
      "conflictsWith": [
        "SRC-001",
        "SRC-002",
        "SRC-006"
      ],
      "locator": {
        "kind": "uri",
        "value": "https://app.notion.com/p/3ab68a85148e81fab11de0a36bf2a0e7"
      },
      "observedAt": "2026-08-03T00:40:43+09:00",
      "sourceVersion": {
        "kind": "last_edited_at",
        "value": "2026-07-31T02:20:10.763Z"
      },
      "note": "부서장만 제출한다고 기록한 과거 작업으로 최신 화면과 직접 확인에 의해 대체됐습니다."
    },
    {
      "id": "SRC-006",
      "title": "구매 요청 제출 권한에 대한 기획 담당자 최신 확인",
      "kind": "conversation",
      "authority": "direct_decision",
      "approvalState": "approved",
      "conflictsWith": [
        "SRC-005"
      ],
      "locator": {
        "kind": "conversation_ref",
        "value": "current-thread/vada-finance-submitters-planner-confirmation-2026-08-03"
      },
      "observedAt": "2026-08-03T15:00:00+09:00",
      "sourceVersion": null,
      "note": "부서장과 재정부 구성원 모두 구매 요청을 제출할 수 있다고 직접 확인했습니다."
    },
    {
      "id": "SRC-007",
      "title": "구매 요청 제출 결과에 대한 제품 책임자 결정",
      "kind": "conversation",
      "authority": "direct_decision",
      "approvalState": "approved",
      "conflictsWith": [
        "SRC-001"
      ],
      "locator": {
        "kind": "conversation_ref",
        "value": "current-thread/vada-finance-submission-confirmation-2026-08-03"
      },
      "observedAt": "2026-08-03T14:48:56+09:00",
      "sourceVersion": null,
      "note": "제출 성공을 명확히 알리고 새 요청을 목록에서 확인하며 새로고침 후에도 보존하는 목표 행동을 승인했습니다."
    },
    {
      "id": "SRC-008",
      "title": "구매 요청 초안 보관 방식에 대한 제품 책임자 결정",
      "kind": "conversation",
      "authority": "direct_decision",
      "approvalState": "approved",
      "conflictsWith": [
        "SRC-001"
      ],
      "locator": {
        "kind": "conversation_ref",
        "value": "current-thread/vada-finance-server-draft-decision-2026-08-03"
      },
      "observedAt": "2026-08-03T16:38:57+09:00",
      "sourceVersion": null,
      "note": "임시 저장한 구매 요청은 브라우저 로컬 데이터가 아니라 서버의 계정별 개인 초안을 정본으로 삼고, 같은 계정에서 복원하며 저장 실패를 명확히 알리기로 승인했습니다."
    }
  ],
  "domainRef": {
    "id": "DOMAIN-FIN",
    "revision": 1
  },
  "spec": {
    "outcome": {
      "id": "OUTCOME-001",
      "actorRefs": [
        "ACTOR-DEPARTMENT-HEAD",
        "ACTOR-FINANCE-MEMBER"
      ],
      "trigger": "행사 운영에 필요한 물품·제작·인쇄·대여·용역의 예산 사용을 요청하려고 합니다.",
      "result": "권한 보유자가 하나 이상의 품목을 제출하고, 성공 여부와 저장된 요청을 자신의 요청 목록에서 다시 확인합니다.",
      "origin": {
        "kind": "owner_stated",
        "sourceRefs": [
          "SRC-001",
          "SRC-006",
          "SRC-007"
        ],
        "itemRefs": []
      }
    },
    "preconditions": [
      {
        "id": "PRECONDITION-001",
        "text": "구매 요청을 연결할 행사가 선택되어 있습니다.",
        "domainRuleRefs": [
          "DOMAIN-RULE-REQUEST-COMPOSITION"
        ],
        "flowRuleRefs": [],
        "origin": {
          "kind": "source_extracted",
          "sourceRefs": [
            "SRC-001",
            "SRC-003"
          ],
          "itemRefs": []
        }
      },
      {
        "id": "PRECONDITION-002",
        "text": "현재 사용자는 부서장 또는 재정부 구성원입니다.",
        "domainRuleRefs": [
          "DOMAIN-RULE-PURCHASE-REQUEST-CREATE"
        ],
        "flowRuleRefs": [],
        "origin": {
          "kind": "source_extracted",
          "sourceRefs": [
            "SRC-001",
            "SRC-002",
            "SRC-006"
          ],
          "itemRefs": []
        }
      }
    ],
    "rules": [
      {
        "id": "FLOW-RULE-REQUEST-COMMON-INPUT",
        "category": "validation",
        "text": "요청 제목·필요한 날짜·구매 목적은 필수이고 우선순위는 보통 또는 긴급입니다. 행사는 현재 행사, 요청 부서는 현재 사용자 소속으로 기록합니다.",
        "origin": {
          "kind": "source_extracted",
          "sourceRefs": [
            "SRC-001"
          ],
          "itemRefs": []
        }
      },
      {
        "id": "FLOW-RULE-ITEM-COMMON-INPUT",
        "category": "validation",
        "text": "각 품목은 품목명·카테고리·예산 항목·구매 유형·양수 수량·단위·양수 예상 단가를 가집니다. 일반 구매는 상품 링크·판매처·가격 화면 중 하나, 그 밖의 유형은 업체 견적 정보가 필수입니다.",
        "origin": {
          "kind": "source_extracted",
          "sourceRefs": [
            "SRC-001"
          ],
          "itemRefs": []
        }
      },
      {
        "id": "FLOW-RULE-TYPE-SPECIFIC-INPUT",
        "category": "validation",
        "text": "일반 구매는 판매처·URL·옵션·배송 요청, 제작·인쇄는 종류·규격·색상·옵션별 수량·인쇄 방식·납품일·파일·요청사항, 대여는 대여처·수령 장소·기간·연락처·보증금·조건, 용역은 제공자·장소·기간·연락처·범위·요청사항을 추가로 입력할 수 있습니다. 현재 화면에서 필수 표시가 없는 상세 항목은 선택 입력이며 입력한 값은 품목과 함께 보존합니다.",
        "origin": {
          "kind": "owner_stated",
          "sourceRefs": [
            "SRC-001",
            "SRC-007"
          ],
          "itemRefs": []
        }
      },
      {
        "id": "FLOW-RULE-TOTAL-CALCULATION",
        "category": "calculation",
        "text": "품목 예상 금액은 수량×예상 단가이고 요청 총액은 모든 품목 예상 금액의 합입니다.",
        "origin": {
          "kind": "source_extracted",
          "sourceRefs": [
            "SRC-001"
          ],
          "itemRefs": []
        }
      },
      {
        "id": "FLOW-RULE-DRAFT-RESUME",
        "category": "lifecycle",
        "text": "사용자는 작성 중인 요청을 자신의 계정에 임시 저장하고, 같은 계정의 같은 행사 작성 화면에서 다시 열어 이어서 작성하거나 초안을 삭제할 수 있습니다. 초안은 제출 전까지 다른 구성원과 재정부 검토 목록에 노출하지 않습니다.",
        "origin": {
          "kind": "owner_stated",
          "sourceRefs": [
            "SRC-008"
          ],
          "itemRefs": []
        }
      },
      {
        "id": "FLOW-RULE-DRAFT-SAVE-RESULT",
        "category": "lifecycle",
        "text": "임시 저장은 서버 보관이 성공한 경우에만 저장 완료로 알립니다. 보관에 실패하면 현재 입력을 유지하고 저장되지 않았음을 표시하며 사용자가 다시 시도할 수 있어야 합니다.",
        "origin": {
          "kind": "owner_stated",
          "sourceRefs": [
            "SRC-008"
          ],
          "itemRefs": []
        }
      },
      {
        "id": "FLOW-RULE-SUBMISSION-VALIDATION",
        "category": "validation",
        "text": "필수 요청 정보와 하나 이상의 유효한 품목이 모두 있을 때만 제출하고, 실패하면 요청을 생성하지 않은 채 수정할 항목을 표시합니다.",
        "origin": {
          "kind": "source_extracted",
          "sourceRefs": [
            "SRC-001"
          ],
          "itemRefs": []
        }
      },
      {
        "id": "FLOW-RULE-SUBMISSION-RESULT",
        "category": "lifecycle",
        "text": "제출 성공 시 요청과 모든 품목을 검토 대기로 한 번만 저장하고 작성 초안을 제거합니다.",
        "origin": {
          "kind": "owner_stated",
          "sourceRefs": [
            "SRC-001",
            "SRC-007"
          ],
          "itemRefs": []
        }
      },
      {
        "id": "FLOW-RULE-CONFIRMATION-AND-PERSISTENCE",
        "category": "lifecycle",
        "text": "제출 성공을 사용자에게 명확히 알린 뒤 내 구매 요청 목록으로 이동해 새 요청을 맨 위에 표시하고, 상세 진입과 새로고침 후에도 같은 요청 내용을 확인할 수 있어야 합니다.",
        "origin": {
          "kind": "owner_stated",
          "sourceRefs": [
            "SRC-007"
          ],